{
  "$schema": "https://json-schema.org/draft/2020-12/schema",
  "$id": "https://opencmo.io/contracts/schedule-defaults.schema.json",
  "title": "OpenCMO default posting slots",
  "description": "How Schedule proposes a time (schedule-publish.md §5): default local times per platform, the gap and caps, the firing window. SQL's schedule_rules() returns the same object; apps/web/lib/cmo/schedule-defaults.check.ts compares them in check:contracts.",
  "type": "object",
  "required": ["minGapHours", "windowMinutes", "leadMinutes", "horizonDays", "maxProposals", "jitterSeconds", "platforms"],
  "additionalProperties": false,
  "properties": {
    "$schema": { "type": "string" },
    "$comment": { "type": "string" },
    "minGapHours": { "type": "integer", "minimum": 1, "maximum": 24, "description": "Least time between two posts on one platform." },
    "windowMinutes": { "type": "integer", "minimum": 5, "maximum": 120, "description": "After the approved time plus jitter, how long a slot may still fire; past it the slot is missed, never posted late." },
    "leadMinutes": { "type": "integer", "minimum": 5, "maximum": 1440, "description": "A proposed time is at least this far from now, so the founder has time to approve it." },
    "horizonDays": { "type": "integer", "minimum": 1, "maximum": 60, "description": "How many days ahead a proposal looks for a free slot." },
    "maxProposals": { "type": "integer", "minimum": 1, "maximum": 10, "description": "Times one deliverable is proposed on one platform before Schedule stops asking." },
    "jitterSeconds": { "type": "integer", "minimum": 0, "maximum": 240, "description": "Natural posting: a slot fires up to this many seconds either side of its time." },
    "platforms": {
      "type": "object",
      "required": ["x", "threads", "linkedin", "tiktok", "instagram", "youtube"],
      "additionalProperties": false,
      "patternProperties": {
        "^[a-z]+$": {
          "type": "object",
          "required": ["times", "dailyCap"],
          "additionalProperties": false,
          "properties": {
            "times": { "type": "array", "minItems": 1, "items": { "type": "string", "pattern": "^([01][0-9]|2[0-3]):[0-5][0-9]$" } },
            "dailyCap": { "type": "integer", "minimum": 1, "maximum": 20 }
          }
        }
      }
    }
  }
}
